[
    {
        "id": "Cona1",
        "naziv": "Ogrevana cona",
        "klasifikacija": "St-1",
        "brutoProstornina": 672,
        "netoProstornina": 400,
        "ogrevanaPovrsina": 160,
        "dolzina": 10,
        "sirina": 8,
        "etaznaVisina": 3,
        "steviloEtaz": 3,

        "notranjaTOgrevanje": 20,
        "notranjaTHlajenje": 26,
        
        "infiltracija": {
            "n50": 0.6,
            "lega": "naPodezeljuMedDrevesi",
            "zavetrovanost": "izpostavljenihVecFasad"
        },

        "notranjiViri": {
            "ogrevanje": 4.1,
            "hlajenje": 4.1
        },

        "toplotnaKapaciteta": 165000,

        "TSV": {
            "toplaVodaT": 42,
            "hladnaVodaT": 10
        },

        "razsvetljava": {
            "faktorDnevneSvetlobe": 0.05,
            "mocSvetilk": 4
        },

        "prezracevanje": {
            "_vrsta": "mehansko",
            "_regulacija": "brez",
            "_volumenProjekt": 200,
            "_volumenDovedenegaZraka": {
                "ogrevanje": 200,
                "hlajenje": 200
            },

            "__vrsta": "naravno",
            "__izmenjava": {
                "ogrevanje": 0.5,
                "hlajenje": 0.5
            },

            "vrsta": "rekuperacija",
            "regulacija": "brez",
            "izkoristek": 0.9,
            "volumenProjekt": 200,
            "volumenDovedenegaZraka": {
                "ogrevanje": 200,
                "hlajenje": 200
            }
        },

        "deltaPsi": 0.04,
        "ovoj": {
            "netransparentneKonstrukcije": [
                {
                    "id": "K1",
                    "idKonstrukcije": "Z1",
                    "povrsina": 243,
                    "naklon": 90,
                    "orientacija": "S",
                    "barva": "svetla"
                },
                {
                    "id": "K2",
                    "idKonstrukcije": "Tp1",
                    "povrsina": 200,
                    "obseg": 40,
                    "debelinaStene": 0.46,
                    "tla": "pesek",
                    "dodatnaIzolacija": {
                        "lambda": 0.04,
                        "tip": "vertikalna",
                        "debelina": 0.2,
                        "dolzina": 0.5
                    }
                },
                {
                    "id": "K3",
                    "idKonstrukcije": "Ts1",
                    "povrsina": 200
                }
            ],
            "transparentneKonstrukcije": [
                {
                    "id": "V1",
                    "idKonstrukcije": "V1",
                    "povrsina": 3,
                    "naklon": 90,
                    "orientacija": "S",
                    "delezOkvirja": 1
                },
                {
                    "id": "O1",
                    "idKonstrukcije": "O1",
                    "povrsina": 15,
                    "naklon": 90,
                    "orientacija": "V",
                    
                    "visinaStekla": 2.3,
                    "sirinaStekla": 5.8,

                    "delezOkvirja": 0.1,
                    "dolzinaOkvirja": 16.2,

                    "faktorSencil": 0.05,

                    "stranskoSencenje": {
                        "zgorajDolzina": 0.2,
                        "zgorajRazdalja": 0.0,
                        "levoDolzina": 0.2,
                        "levoRazdalja": 0,
                        "desnoDolzina": 0.2,
                        "desnoRazdalja": 0
                    },

                    "sencenjeOvir": [
                        {
                            "kvadrant": 2,
                            "visinaNadTerenom": 1,
                            "visinaOvire": 20,
                            "oddaljenostOvire": 5
                        }
                    ]
                },
                {
                    "id": "O2",
                    "idKonstrukcije": "O1",
                    "stevilo": 3,

                    "povrsina": 5,
                    "naklon": 90,
                    "orientacija": "J",
                    
                    "visinaStekla": 2.3,
                    "sirinaStekla": 1.8,

                    "delezOkvirja": 0.17,
                    "dolzinaOkvirja": 8.2,

                    "faktorSencil": 0.3,

                    "stranskoSencenje": {
                        "zgorajDolzina": 0.2,
                        "zgorajRazdalja": 0,
                        "levoDolzina": 0.2,
                        "levoRazdalja": 0,
                        "desnoDolzina": 0.2,
                        "desnoRazdalja": 0
                    }
                },
                {
                    "id": "O3",
                    "idKonstrukcije": "O1",
                    "stevilo": 2,
                    
                    "povrsina": 1,
                    "naklon": 90,
                    "orientacija": "V",
                    
                    "visinaStekla": 0.9,
                    "sirinaStekla": 0.9,

                    "delezOkvirja": 0.19,
                    "dolzinaOkvirja": 3.6,

                    "faktorSencil": 0.3,

                    "stranskoSencenje": {
                        "zgorajDolzina": 0.2,
                        "zgorajRazdalja": 0,
                        "levoDolzina": 0.2,
                        "levoRazdalja": 0,
                        "desnoDolzina": 0.2,
                        "desnoRazdalja": 0
                    }
                },
                {
                    "id": "O4",
                    "idKonstrukcije": "O1",
                    "stevilo": 2,
                    
                    "povrsina": 1,
                    "naklon": 90,
                    "orientacija": "S",
                    
                    "visinaStekla": 0.9,
                    "sirinaStekla": 0.9,

                    "delezOkvirja": 0.19,
                    "dolzinaOkvirja": 3.6,

                    "faktorSencil": 0.3,

                    "stranskoSencenje": {
                        "zgorajDolzina": 0.2,
                        "zgorajRazdalja": 0,
                        "levoDolzina": 0.2,
                        "levoRazdalja": 0,
                        "desnoDolzina": 0.2,
                        "desnoRazdalja": 0
                    }
                }
            ]
        }
    }
]